review_id,product_id,rating,title,text,reviewer_name,location,date_relative,date,scraped_at,sentiment,themes,proof_note
04e9fa1f91a5ad3accfadc7cfb533d23,itm85415864eeb6f,5.0,Best Sound quality,"It effectively handles ambient hums and moderate background noise, though nearby chatter or very loud environments can still seep through. The design and build quality are highly impressive, giving it...more",chaudhary chaudhary,New Delhi,8 months ago,2025-11-04,2026-07-02 03:51:14,Positive,"Sound Quality, Build Quality",recaptured_in_controlled_delta_test
0679c50d2e6fd9741b45aef80aea0d94,itm6cb40e9367c08,5.0,Must buy!,I really loved sound quality.. best in this budget.. High class sound go for it without any doubt..,Rahul Vaishnav,Kota,3 months ago,2026-04-03,2026-07-02 03:51:14,Positive,Sound Quality,recaptured_in_controlled_delta_test
07dc07ae8d70e3ba47896511d2f1d8b1,itm6cb40e9367c08,5.0,Perfect product!,"Bass and spacial audio quality excellent, nice and great design. Completely satisfied. Stunning and stylish.",Narasimha S,West Godavari,8 months ago,2025-11-04,2026-07-02 03:51:14,Positive,"Sound Quality, Build Quality",recaptured_in_controlled_delta_test
943d9fead26d8d24f2c8f1d1a123d491,itm6cb40e9367c08,5.0,Must buy!,Very nice sound,Guddu Babu,Deoghar District,8 months ago,2025-11-04,2026-07-02 03:51:14,Positive,Sound Quality,recaptured_in_controlled_delta_test
9c2c941091d02be1945457ae33aa9843,itm6cb40e9367c08,1.0,Useless product,Bad product,Manish Verma,Ghaziabad,8 months ago,2025-11-04,2026-07-02 03:51:14,Negative,,recaptured_in_controlled_delta_test
